id,theme_name,definition
1,Physical harassment,"An incident or a series of incidents that aim to physically harass Asians/Asian Americans in order to intimidate, offend or harm them. Examples of physical harassment include using body languages/gestures to harass/threaten, pushing/shoving, slapping, spitting, pepper-spraying or using spraying can, coughing on, blocking someone from entering a building, harassing a restaurant by making an order but not taking, or following/stalking someone. These behaviors do not cause injuries or death, but already make Asians/Asian Americans feel intimidated, offended, and anxious."
2,Worry about safety,"Asians/Asian Americans worried about their safety because they were discriminated, attacked, harassed, or injured or their properties (e.g., restaurants, cars, or houses) be vandalized or destroyed during the COVID-19 pandemic. In addition to direct experiences, seeing the above incidents can also lead to their worries about safety."
3,Proactive self-defense/protection,"After seeing other Asians/Asian Americans be  started protecting themselves discriminated, attacked, harassed, or injured or their properties (e.g., restaurants, cars, or houses) be vandalized or destroyed during the COVID-19 pandemic, they start proactively protecting themselves or preventing themselves from being attacked. Examples include installing a surveillance video system, buying guns/firearms and carrying concealed guns, going or running fast when going home, guarding their houses/homes, hiring private armed security guards, providing shopkeepers with air horns, and buying pepper sprays. "
4,Other minorities (Black) attack AA,"Black/Brown adults and teenagers conduct Anti-Asian violence, assaults, and attacks. The behaviors vary from knocking down someone, hitting, to killing, which can cause injuries and even death. "
5,Verbal harassment,"Asians/Asian Americans experienced verbal harassment/abuse in oral (e.g., in person or via phone) or written forms (e.g., graffiti and written messages/notes). One type is racist slurs/epithets or derogatory/stereotype names, such as scum bucket China boy, commie, stupid, ching chong, retard chinaman, nuke china, or using dirty words (e.g., fuck, f…ing[articles removed some letters in fucking]). The second type is hate speech/Anti-Asian rhetoric, such as blaming Asians/Asian Americans for causing the pandemic (problem/covid), telling them to go back to China, home, or where you came from or get out of my country, using threatening words (e.g., I’ll kill you or hope you die), or provocative languages (e.g., asking if you carry COVID-19). The third type is using Asian-related objects to combine with disease (virus/flu/covid) or directly calling coronavirus/covid (e.g., country’s or region’s names, Asian food, Kung flu[modified by Kung Fu], or races) to verbally harass Asians/Asian Americans, such as  “China/Chinese virus” or “Kung flu/plague” or “Wuhan virus/plague” or “Diseased Chinese” or “Asian Virus” or “Ramen Noodle flu.”"
6,Online harassment,"Asians/Asian Americans experienced online harassment/abuse/bullying via email or social media (e.g., facebook, twitter, and instagram). The types are similar as those in verbal harassment. One type is racist slurs/epithets or derogatory/stereotype names, such as scum bucket China boy, commie, stupid, ching chong, retard chinaman, nuke china, or using dirty words (e.g., fuck, f…ing[articles removed some letters in fucking]). The second type is hate speech/Anti-Asian rhetoric, such as blaming Asians/Asian Americans for causing the pandemic (problem/covid), telling them to go back to China, home, or where you came from or get out of my country, using threatening words (e.g., I’ll kill you or hope you die), or provocative languages (e.g., asking if you carry COVID-19). The third type is using Asian-related objects to combine with disease (virus/flu/covid) or directly calling coronavirus/covid (e.g., country’s or region’s names, Asian food, Kung flu[modified by Kung Fu], or races) to verbally harass Asians/Asian Americans, such as  “China/Chinese virus” or “Kung flu/plague” or “Wuhan virus/plague” or “Diseased Chinese” or “Asian Virus” or “Ramen Noodle flu.”  Hashtags are used in Twitter, such as #gobacktochina and"
7,Racial/Anti-Asian bigotry,#makethecommiechinesepay.
8,Not confronting  attacker/harasser or not reporting,"Unreasonable attachment to a belief, opinion, or faction, which is a form of prejudice against Asians/Asian Americans."
9,Videotaping/confronting harasser/attacker,Asians/Asian Americans did not want to confront attackers/harassers/bullies who physically or verbally harassed or attacked them. They thought it is not worthy of reporting the incidents. They did not want to confront because they were afraid of their safety. They just wanted to leave from the incidents soon.
10,Support Asian Americans,"Asians/Asian Americans or bystanders videotaped/recorded the incidents of physical or verbal harassment; Anti-Asian attacks, assaults, or violence; and Anti-Asian crimes. Asians/Asian Americans who suffered physical harassment, attacks, assaults, violence attacked back to the harassers or attackers. Bystanders’ behaviors aim to defense those who were attacked. Cell phones and survelliance system can be used for videotaping or recording. Additionally, those who experienced verbal harassment speak out to the harassers to let them know their thoughts were biased, offensive, and unjust and tell them to stop. "
11,"Reasons behind not reporting (language/cultural barriers, distrust of police, fear of keeping immigrant status, hard to approve)","Asians/Asian Americans condemned/do not want Anti-Asian incidents to happen, including all forms of crimes, attacks, violence, assaults, physical, verbal, and online harassment. They called for standing against and fighting with Anti-Asian hate and taking actions to stop it. Victims and all Asian Americans are encouraged to speak up in public, such as via social media, to condemn Anti-Asian hate. Indeed, some Asian Americans (including celebrities, such as Jeremy Lin) or other racial groups actively spoke up on social media and attended marches/rallies for supporting Asian American communities. Some governors (e.g., city mayors) also went to Asian American communities (e.g., Asian restaurants or China Town) to express their support. It’s also encouraged to use media to cover anti-Asian violence to help bring awareness. Another form of support is to encourage the reporting of hate incidents. Some cities install hotlines for victims or people who witness Anti-Asian incidents to report. The third form of support is to directly provide support and resources for Asians and Asian Americans to decrease or minimize Anti-Asian incidents, such as hiring private armed security guards and providing shopkeepers with air horns. The fourth form of support is via education. Schoolteachers and university faculty promoted inclusion of Asians/Asian Americans, fostered"
12,Mistrust police/law enforcement,"conversations regarding the Anti-Asian hate issues, and educating students on current social and political issues on Anti-Asian hate. Asian American communities also think it’s important to address the root cause behind the Anti-Asian hate incidents so this will help us to make change. The fifth form of support is that Asians/Asian Americans become united to support each other to overcome Anti-Asian hate."
13,Useless law enforcement(police)/lack of law enforcement cooperation,"Some Asian Americans did not report hate crimes against Asian Americans because of language/cultural barriers, distrust of police, fear of keeping immigrant status, and difficulty in approving those crimes.  "
14,Government takes actions to stop AAPI hate,"Asians/Asian Americans did not trust police would save/protect them from being physically or verbally harassed, attacked, assaulted, or experiencing violence and Anti-Asian crimes."
15,Hoping or advocacy for change (in the large society; in educational systems),"Police did not take a police report and denied there was an Anti-Asian hate crime for the incidents of physical harassment, attacks, assaults, violence, and Anti-Asian crimes. Another situation is that police affirmed there was a crime, but the motivation did not come from Anti-Asian hate or bigotry/prejudice or racism. Additionally, Asian Americans thought if police often patrolled the streets, a lot of Anti-Asian hate crimes, attacks, assaults, and violence would not happen. But in reality, policy did not do so. "
16,Feeling hopeless or support for AAPI being not enough,"After the incidents of Anti-Asian hate crimes, attacks, assaults, and violence, state or city government take actions, including "
17,Anti-Asian hate crimes,"launching the Asian Hate Crime Task Force, announcing opposing violence against the AAPI community, increasing patrols in neighborhoods, organizing a town hall to address concerns about anti-Asian hate crimes, using legislation to expand criminal background checks on firearms, and mandating the collection and reporting of hate crimes by law enforcement."
18,Ignoring Anti-Asian Hate Crime,"Asians/Asian Americans want or advocate for changing the current situation where Asians/Asian Americans suffered from Anti-Asian hate, including physical, verbal, and online harassment, attacks, violence, assaults, and hate crimes. They want cultural shift, open dialogue and listening sessions regarding incidents, practical change in racial stereotypes"
19,Recidivism,"and perceptions, more awareness about Anti-Asian hate, and human rights. It’s also important to"
20,Anti-Asian violence/ assaults/attacks ,keep telling the stories of the injustices the Asian
21,Xenophobia,"communities are facing. It doesn’t make sense to let Asians/Asian Americans suffer Anti-Asian hate. Some talk about how it is important to let schools and colleges hold accountability, such as addressing injustices Asian Americans face. Asians/Asian Americans must work together to combat hate and ensure that all perpetrators are brought to justice."
22,Stop AAPI Hate,"Asians/Asian Americans felt worried, frustrated, anxious, and afraid that they may experience Anti-Asian hate crimes, attacks, assaults, and violence. But they felt that nothing happened to stop them. Support for Asian American communities is not enough. "
23,Donald Trump,"Hate incidents targeted toward Asians and Asian Americans or individuals perceived as Asian descent. These hate incidents can include physical assaults or attacks. Different from anti-Asian violence or attacks, such incidents have been investigated by the police."
24,“China/Chinese virus” or “Kung flu/plague” or “Wuhan virus/plague” or “Diseased Chinese” or “Asian Virus” or “Ramen Noodle flu”,Asians/Asian Americans suffer from Anti-Asian hate incidents but their experiences were ignored.
25,“Ching Chong”,"Attackers repeatedly attacked, assaulted, or harassed Asians/Asian Americans."
26,“Commie”,"These could include verbal harassment (e.g., written, visual, or auditory), physical injuries (e.g., struck in the face causing nosebleed, cut lip, bruised thigh and hip, sore shoulder, and bloody elbow), or property harm (e.g., harm directed at someone’s property, such as car, house, or other personal items)"
27,Yellow peril,"The dislike of or prejudice against people from other countries. In this case, those from Asian countries."
28,COVID-19 or coronavirus or pandemic,"A U.S.-based coalition dedicated to ending racism and discrimination against Asian Americans and Pacific Islanders (AAs & PIs). It is created due to the need to document the rise of COVID-19-related anti-Asian racism in the early stages of the global pandemic and joined forces to launch an online reporting center. As the nation’s largest reporting center tracking anti-AAPI hate acts, the coalition publishes data insights and research findings to paint a vivid and nuanced picture of racism and other forms of bigotry as it is experienced by AAPI communities. "
29,Fetishized or fetishization ,"The former US president, Donald, Trump, made a lot of comments on the COVID-19 pandemic. One kind of comment is that he used/dubbed Asian-related objects to combine with disease (virus/flu/covid) or directly calling coronavirus/covid (e.g., country’s or region’s names or Kung flu[modified by Kung Fu], or races) to verbally attack Asians/Asian Americans, such as  “China/Chinese virus” or “Kung flu.” Another type of comment is that he blamed China for causing the pandemic. Such kinds of comments reinforced racism, Anti-Asian bigotry/hate, and Anti-Asian incidents in the US society. Such comments also led some Americans to blame Asians/Asian Americans for causing the pandemic. But Former White House spokeswoman has said Mr. Trump wasn't being offensive when he referred to the virus as ""kung flu"" or “China virus” but was ""linking it to its place of origin."" The third type of comment is that Mr. Trump said there was no Anti-Asian hate crimes. On the other hand, Mr. Trump also made another type of comment that was contradictory to the previous comments with the Anti-Asian sentiment. This comment addressed that the pandemic/virus was not the fault of Chinese Americans and we have to protect Asian American communities in the United States."
30,Hypersexualization of Asian women,"A kind of inflammatory comment by using/bubbing Asian-related objects to combine with disease (virus/flu/covid) or directly calling coronavirus/covid (e.g., country’s or region’s names, Asian food, Kung flu[modified by Kung Fu], or races) to verbally harass or attack Asians/Asian Americans, such as  “China/Chinese virus” or “Kung flu/plague” or “Wuhan virus/plague” or “Diseased Chinese” or “Asian Virus” or “Ramen Noodle flu.” Mr. Donald Trump was perceived as the first to do so, which reinforced the public’s use of such comment to harass Asians/Asian Americans"
31,Sexualized or Sexualization,"Generally, this is an ethnic slur that is used to mock or imitate the Chinese language, people of Chinese ancestry, or other people of Asian descent perceived to be Chinese or related with Chinese. In the context of the COVID-19 pandemic, this slur is used to verbally harass Asians/Asian Americans during the COVID-19 pandemic regardless of whether the victims are Chinese descent or not.  "
32,Exotic (describing Asian women),"Commie means communist, which is related with Chinese. This term is used as a derogatory/stereotype name to verbally harass Asians/Asian Americans "
33,Misogyny,"A racist metaphor that depicts the people of East and Southeast Asia as an existential danger to the Western world. The concept was developed during the 19th century when Chinese workers legally immigrated to the West. Their work ethic provoked a racist backlash against Chinese communities, for agreeing to work for lower wages than did the local white populations."
34,White supremacy,The global pandemic that began in early 2020. 
35,Preserve whiteness ,Having an unreasonable amount of sexual interest in Asian women. Or viewing Asian women as sexual objects.
36,White privilege,"Involves the attribution by the media of a sexual character to a product or behavior that has nothing intrinsically sexual about it. When applied to Asian women, being viewed as submissive, exotic, and being fetishized. Some examples include viewing Asian women as lotus blossoms, butterflies (who is a demure, devoted, and submissive wife), dragon ladies (as a sinister, crafty, and destructive seductress). Hypersexualization can be seen in magazines, videos, films, the fashion industry and particularly in advertising. Examples include “Madame Butterfly”, “Miss Saigon”, and “Full Metal Jacket”."
37,Otherized (or othering),"Placing an emphasis on the sexual nature of a behavior or a person. Linked to sexual objectification, treating a person solely as an object of sexual desire"
38,Racism (general),"Asian women being viewed as different, strange, or unusual "
39,"Racism (gendered, misogynistic) or racism toward Asian American women)","A dislike of or ingrained prejudice against women. Include feeling, showing, or characterized by hatred against women. "
40,Systemic racism,"The belief that white people constitute a superior race and should dominate society, typically to the exclusion or detriment of other racial and ethnic groups."
41,Color blind/minimizing racism,"Maintaining the mostly hidden benefits that white people possess in a society (e.g., white privilege) and white supremacist cultural values."
42,Feelings of invisibility (or invisible minority),"The societal privilege that benefits white people over non-white people in some societies, particularly if they are otherwise under the same social, political, or economic circumstances. White privilege is a social phenomenon intertwined with race and racism. The term is used in discussions focused on the mostly hidden benefits that white people possess in a society where racism is prevalent and whiteness is considered normal. "
43,Feelings of being vulnerable ,"Peggy McIntosh developed the term to explain how “Whites are taught to view their social, cultural, and economic experiences as the norm that everyone should experience, rather than as an advantaged position that must be maintained at the expense of others. It confers unsolicited racial dominance from birth."
44,Model Minority Myth (or myth of the model minority),"Viewing or treating (a person or a group of people) as intrinsically different from and alien to oneself. It is a phenomenon in which some individuals or groups are defined and labeled as not fitting in within the norms of a social group. It is an effect that influences how people perceive and treat those who are viewed as being part of the in-group versus those who are seen as being part of the out-group. “Othering” involves attributing negative characteristics to people or groups that differentiate them from the perceived normative social group. For example, by referring to Asian Americans as a “model minority” or as “perpetual foreigners” (or “forever foreigners”) is an act of othering. "
45,Being discriminated but also being model minority,1. The belief that races are populations of people whose physical differences are linked to significant cultural and social differences and that these innate hierarchical differences can be measured and judged.
46,Asian culture being appreciated but AA received no respect or were attacked,2. The practice of subordinating races believed to be inferior. 
47,Perpetual foreigner (or forever foreigner or go back to China or You don’t belong to here),"A form of oppression that occurs due to race and gender. It is perpetuated due to the prevalence of perceptions, stereotypes, and images of certain groups. It differs from “racism” or “sexism” in that it pertains specifically to racial and ethnic understandings of masculinity and femininity, as well as along gendered forms of race and ethnic discrimination. The ways in which Asian American women are typically viewed in the US (e.g., exotic and fetishized, but also submissive) contribute to their experience of gendered racism, especially for the Atlanta shootings "
48,Sex addiction or sexual addiction (as describing the Atlanta shooter),"Defined by sociologist Joe Feagin as a diverse assortment of racist practices, encompassing daily microaggressions, deep-seated inequalities, historical inequalities, and anti-Black ideologies. "
49,Sexual violence,Systemic racism can be defined as policies and practices that exist throughout a whole society that leads to a continued unfair advantage to some people and unfair or harmful treatment of others based on race. Examples include:
50,Sex workers,"When one group of people and their values, ways of doing things are classified as “normal” and other groups of people are “abnormal”."
51,Racial trauma,"The political power to withhold basic rights from people of color and use the full power of the state to enforce segregation and inequality, in practice."
52,Racial injustice,The social power to deny people of color full inclusion or membership in associational life.
53,Racial prejudice,"The economic power that privileges white people in terms of job placement, advancement, wealth, and property accumulation."
54,Racial inequity,"Some Americans do not believe discrimination, racism, or racist bias/bigotry against Asians/Asian Americans exists in the community. Incidents of anti-Asian hate (including physical, verbal, and online harassment, attacks, violence, assaults, and Anti-Asian crimes) were downplayed, ignored, or perceived as not existing by the public, the law enforcement system (e.g., the police), and governors (e.g., Mr. Donald Trump). When Asians/Asian Americans were attacked, Anti-Asian hate or racism was not perceived as the perpetrators’ motives/motivations by the police or the perpetrators said their motivations were not triggered by Anti-Asian bigotry or racism.  "
55,Racial oppression,"Hate crimes against Asian Americans had received relatively little attention or been ignored by the public and news outlet. Also, Asians/Asian Americans feel they are invisible, forgotten, and neglected community."
56,Racial bias,"Asians/Asian Americans feel they are vulnerable to Anti-Asian hate crimes, discrimination, harassment, attacks, violence, and assaults. They are worried about their safety. Some feel that Asian/Asian American women are more vulnerable. Furthermore, poor and immigrant Asian women are the most vulnerable group.  "
57,Stereotypes,"Asian Americans are stereotyped as model minority, meaning that they seem not to suffer in the classroom or in the economy (doing well in school and at work). Other stereotypes include that Asian Americans tend not to complain and attacking on them can’t really hurt them. "
58,Discrimination ,"Asian Americans were discriminated and suffered from Anti-Asian hate harassment, attacks, assaults, violence, and crimes. But they were also perceived as model minority, meaning that they did not have problems and adjusted well in every aspect, such as learning and working. Such stereotype masked the discriminatory and racist experiences they had."
59,Reasons behind racism/discrimination (Undermining human rights; Donald Trump’s comment),"Asian culture is appreciated. For example, Chinese food and K-pop culture are loved. But on the other hand, Asians were not respected and targeted for violence and experienced Anti-Asian hate."
60,"Impacts of racism on AA population (unemployment, mental health problems, trauma, PTSD, Asian Target Anxiety Syndrome,  negative emotions (sadness), distrust, isolating self, Asian-based business had poor business or was worried about being attacked, child well-being, increasingly purchasing guns to defend themselves)","Asian Americans were perceived as outsiders, perpetual foreigners, and never becoming Americans. The public called them to go back to(two/2) China (their countries/where you come from)/get out here/go home, said you don’t belong to here, or ask them where did you come from or assume you were exchange students, even though many of them were born in the US and had no relation with China. "
61,Scapegoat,"Excessive sexual thoughts, desires, urges or behaviors that can’t be controlled and cause distress and harm to your relationships, finances and other aspects of life. It is also called hypersexuality or compulsive sexual behavior. It is what the Atlanta shooter claimed as a motivation that led to his senseless killings of the victims."
62,Cultural complicity,"A broad category of actions in which a person exerts their power and control over another person through unwanted or harmful sexual actions. It could include sexual assault, sexual coercion, rape, sexual harassment, sexual exploitation, stalking, and relationship violence."
63,Terrorism,"A person who provides sex work, either on a regular or occasional basis. Sex work is different from sexual exploitation, or the forcing of a person to commit sexual acts, in that sex work is voluntary and is seen as the commercial exchange of sex for money or goods. The term is used in reference to those who work in all areas of the sex industry."
64,Domestic terrorism,"Race-based traumatic stress. The mental and emotional injury caused by encounters with racial bias and ethnic discrimination, racism, and hate crimes."
65,Page Act,"When people of color and communities of color do not have full access to the rights and benefits of American society, or when they experience human rights violations due to systemic racism."
66,Microaggressions,The belief that people belong to distinct racial groups with innate hierarchical differences that can be measured and judged
67,Youth as an excuse,"The unequal distribution of resources, power, and economic opportunity across race in a society. This includes racial disparities in wealth, education, employment, housing, mobility, health, and rates of incarceration"
68,Religion,"Unjust or cruel treatment or exercise of power over a group of individuals based on their race. Racial oppression may be social, systematic, institutionalized, or internalized. Social forms of racial oppression include exploitation and mistreatment that is socially supported"
69,Anti-Blackness,"A distortion arising from systemic, institutional, interpersonal or individual forms of explicit (conscious) or implicit (unconscious) prejudice against individuals or groups based on social constructs of race or ethnicity. The primarily unconscious thoughts, preconceptions, or experiences that cause people to think and act in prejudiced ways"
