id,theme_name,definition
70,Asian/African American divide,A widely held but fixed and oversimplified image or idea of a type of person or thing. An example would include: viewing Asian Americans as good at STEM or as the model minority. 
71,Muslim hate,"The practice of treating people differently. In the context of COVID-19 pandemic, Asians/Asian Americans were treated differently due to their racial/ethnic background."
72,Policy changes,"Asians/Asian Americans talked about what factors can lead to anti-Asian hate crime, discrimination, harassment, attack, assaults, and violence. The factors include to dehumanize and to undermine the fundamental rights, dignity and belonging of those they target. Donald Trump (administration)’s and other Republicans’ use of hate/disparaging/derogatory speech and comments with purposes of Anti-Asian racism and discrimination also initiate different forms of Anti-Asian racism in the US. Examples of Trump’s comments include China Virus and Kung Flu.    "
73,American dream being broken,"Impacts of racism on Asian Americans include unemployment, mental health problems, trauma, PTSD, Asian Target Anxiety Syndrome, negative emotions (sadness), distrust, and isolating self. Also, Asian-based business had poor business or was worried about being attacked by the public. Third, children may have hard time to go back to school or experience discrimination. Fourth, there is an increase in purchasing guns among Asian Americans. "
74,Global condemning against Anti-Asian hate crime/violence/racism ,"During the COVID-19 pandemic, the whole world was suffering from the pandemic-related economic crises because a lot of entertainment and social activities were forced to be shutdowned. In such situation, people would like to find scapegoats for the crises. Since COVID-19 was first reported in Wuhan, China, people look like Chinese tend to be attacked. So Asians/Asian Americans tend to be targeted for causing the pandemic and all the related economic crises.   "
